{
  "name": "http.server.request.duration",
  "unit": "s",
  "description": "Server-side handling time per request, by route template and status class.",
  "measurementAttributes": {
    "http.request.method": "GET",
    "http.route": "/v1/users/{id}",
    "http.response.status_code_class": "2xx"
  },
  "resourceAttributes": {
    "service.name": "identity",
    "service.version": "0.3.0",
    "service.instance.id": "identity-2b7e11",
    "deployment.environment": "production",
    "tenant_id": "acme"
  }
}
